{
  "$schema": "https://embeddedos.org/schemas/devboard-cad/v1/board-record.schema.json",
  "contract_version": "1.0.0",
  "board_id": "adafruit:feather",
  "manufacturer": "Adafruit",
  "family": "Adafruit Feather",
  "board": "Adafruit Feather",
  "part_number": "UNVERIFIED",
  "revision": "unverified",
  "mcu_soc": "UNVERIFIED",
  "files": {
    "schematic": {"available": null, "url": null, "verified_revision": null},
    "pcb_source": {"available": null, "url": null, "verified_revision": null},
    "gerbers": {"available": null, "url": null, "verified_revision": null},
    "bom": {"available": null, "url": null, "verified_revision": null},
    "pick_and_place": {"available": null, "url": null, "verified_revision": null},
    "step": {"available": null, "url": null, "verified_revision": null},
    "dxf": {"available": null, "url": null, "verified_revision": null},
    "stl": {"available": null, "url": null, "verified_revision": null},
    "kicad": {"available": null, "url": null, "verified_revision": null},
    "eagle": {"available": null, "url": null, "verified_revision": null},
    "altium": {"available": null, "url": null, "verified_revision": null},
    "mechanical": {"available": null, "url": null, "verified_revision": null}
  },
  "licenses": {
    "hardware_license": "UNVERIFIED",
    "cad_license": null,
    "schematic_license": null,
    "pcb_license": null,
    "mechanical_cad_license": null,
    "redistribution_allowed": null,
    "modification_allowed": null,
    "commercial_use_allowed": null,
    "attribution_required": null,
    "license_url": null
  },
  "sources": {
    "source_tier": "community",
    "official_product_page": "https://www.adafruit.com/",
    "official_cad_repository": null,
    "official_github_repository": null,
    "official_documentation": null,
    "direct_cad_download": null,
    "direct_schematic_download": null,
    "direct_gerber_download": null
  },
  "record_status": "incomplete",
  "notes": "Identity stub only. Issue #28 notes Feather is a large ecosystem of individual boards; each individual board needs its own record. Per issue #28 section 10, part number, MCU, revision, per-format availability, and licensing must each be checked against official Adafruit sources before being recorded. No availability claim is made by this record."
}
